{
  "id": "demo-record-1",
  "namespace": "synthetic-demo",
  "version": 1,
  "content": "The sample project uses Python and a local test runner.",
  "source": "synthetic fixture, not a user fact",
  "created_at": "2026-09-16T00:00:00Z",
  "expires_at": null,
  "allowed_readers": [
    "demo-planner",
    "demo-reviewer"
  ],
  "tags": [
    "demo"
  ]
}
